{
 "schema": "s1flow/policy@2",
 "task": "gh-ruff-area",
 "version": 3,
 "connection": "d1@vercel",
 "model_id": "liquid/d1",
 "questions": {
  "area": {
   "question": {
    "type": "choice",
    "instructions": "Which part of Ruff (a Python linter and formatter) does this issue concern? Classify by the behavior or feature being requested or reported. Use the affected component as the main signal: lint-rule behavior and fixes belong to linter, code layout belongs to formatter, and LSP-specific behavior and settings belong to server.",
    "criteria": {
     "linter": "Lint rules, new checks, detection coverage, false positives, rule-specific fixes, suppression comments (noqa), import sorting, and docstring checks. Requests to detect redundant, deprecated, or problematic Python code belong here, including requests without a rule code.",
     "formatter": "Code layout and style produced by the formatter, such as spacing, indentation, line wrapping, and quote layout.",
     "server": "The language server (LSP), editor integration, and editor-specific settings, including how the server discovers, prioritizes, or applies configuration.",
     "configuration": "General Ruff settings, configuration files, command-line options and behavior, and selecting or enabling rules. Includes how users configure Ruff across CLI workflows."
    }
   },
   "kind": {},
   "rule": {
    "threshold": null,
    "min_probability": 0.8277857139788519
   }
  }
 },
 "at": "2026-10-15T22:09:04Z",
 "s1flow_version": "0.1.0",
 "state_schema": {
  "type": "object",
  "properties": {
   "body": {
    "type": "string"
   },
   "title": {
    "type": "string"
   }
  },
  "required": [
   "body",
   "title"
  ]
 }
}
